{
  "format": 1,
  "kind": "harness-config",
  "harness": "gemini",
  "platform": "darwin",
  "artifacts": [
    {
      "artifact": "hooks.gemini",
      "content": "ewogICJob29rcyI6IHsKICAgICJBZnRlckFnZW50IjogWwogICAgICB7CiAgICAgICAgImhvb2tzIjogWwogICAgICAgICAgewogICAgICAgICAgICAiY29tbWFuZCI6ICIvdXNyL2xvY2FsL2Jpbi9zdHJhemEgaG9vayAtLWhhcm5lc3MgZ2VtaW5pIiwKICAgICAgICAgICAgInR5cGUiOiAiY29tbWFuZCIKICAgICAgICAgIH0KICAgICAgICBdCiAgICAgIH0KICAgIF0sCiAgICAiQmVmb3JlQWdlbnQiOiBbCiAgICAgIHsKICAgICAgICAiaG9va3MiOiBbCiAgICAgICAgICB7CiAgICAgICAgICAgICJjb21tYW5kIjogIi91c3IvbG9jYWwvYmluL3N0cmF6YSBob29rIC0taGFybmVzcyBnZW1pbmkiLAogICAgICAgICAgICAidHlwZSI6ICJjb21tYW5kIgogICAgICAgICAgfQogICAgICAgIF0KICAgICAgfQogICAgXSwKICAgICJCZWZvcmVUb29sIjogWwogICAgICB7CiAgICAgICAgImhvb2tzIjogWwogICAgICAgICAgewogICAgICAgICAgICAiY29tbWFuZCI6ICIvdXNyL2xvY2FsL2Jpbi9zdHJhemEgaG9vayAtLWhhcm5lc3MgZ2VtaW5pIiwKICAgICAgICAgICAgInR5cGUiOiAiY29tbWFuZCIKICAgICAgICAgIH0KICAgICAgICBdLAogICAgICAgICJtYXRjaGVyIjogIioiCiAgICAgIH0KICAgIF0sCiAgICAiU2Vzc2lvblN0YXJ0IjogWwogICAgICB7CiAgICAgICAgImhvb2tzIjogWwogICAgICAgICAgewogICAgICAgICAgICAiY29tbWFuZCI6ICIvdXNyL2xvY2FsL2Jpbi9zdHJhemEgaG9vayAtLWhhcm5lc3MgZ2VtaW5pIiwKICAgICAgICAgICAgInR5cGUiOiAiY29tbWFuZCIKICAgICAgICAgIH0KICAgICAgICBdCiAgICAgIH0KICAgIF0KICB9LAogICJob29rc0NvbmZpZyI6IHsKICAgICJlbmFibGVkIjogdHJ1ZQogIH0KfQ==",
      "content_hash": "sha256:907879dd82cbaa594cdfd3f24e93a3fb4afc3ff8f38735ba465c8c0337c97518",
      "key_id": "spec-example-key",
      "sig": "NJzNxquCMoGNTqh0S+OrQMIS31BUpdAx6N5KMGRsVirwgXT4V+aUv39fCy67uwESqSOEj0fVUbZxylW0jTt5CQ=="
    }
  ]
}
