{
  "format": 1,
  "kind": "harness-config",
  "harness": "claude-code",
  "platform": "linux",
  "artifacts": [
    {
      "artifact": "hooks.claude-code",
      "content": "ewogICJob29rcyI6IHsKICAgICJQcmVUb29sVXNlIjogWwogICAgICB7CiAgICAgICAgImhvb2tzIjogWwogICAgICAgICAgewogICAgICAgICAgICAiY29tbWFuZCI6ICIvdXNyL2xvY2FsL2Jpbi9zdHJhemEgaG9vayAtLWhhcm5lc3MgY2xhdWRlLWNvZGUiLAogICAgICAgICAgICAidHlwZSI6ICJjb21tYW5kIgogICAgICAgICAgfQogICAgICAgIF0sCiAgICAgICAgIm1hdGNoZXIiOiAiKiIKICAgICAgfQogICAgXSwKICAgICJTZXNzaW9uRW5kIjogWwogICAgICB7CiAgICAgICAgImhvb2tzIjogWwogICAgICAgICAgewogICAgICAgICAgICAiY29tbWFuZCI6ICIvdXNyL2xvY2FsL2Jpbi9zdHJhemEgaG9vayAtLWhhcm5lc3MgY2xhdWRlLWNvZGUiLAogICAgICAgICAgICAidHlwZSI6ICJjb21tYW5kIgogICAgICAgICAgfQogICAgICAgIF0KICAgICAgfQogICAgXSwKICAgICJTZXNzaW9uU3RhcnQiOiBbCiAgICAgIHsKICAgICAgICAiaG9va3MiOiBbCiAgICAgICAgICB7CiAgICAgICAgICAgICJjb21tYW5kIjogIi91c3IvbG9jYWwvYmluL3N0cmF6YSBob29rIC0taGFybmVzcyBjbGF1ZGUtY29kZSIsCiAgICAgICAgICAgICJ0eXBlIjogImNvbW1hbmQiCiAgICAgICAgICB9CiAgICAgICAgXQogICAgICB9CiAgICBdLAogICAgIlN0b3AiOiBbCiAgICAgIHsKICAgICAgICAiaG9va3MiOiBbCiAgICAgICAgICB7CiAgICAgICAgICAgICJjb21tYW5kIjogIi91c3IvbG9jYWwvYmluL3N0cmF6YSBob29rIC0taGFybmVzcyBjbGF1ZGUtY29kZSIsCiAgICAgICAgICAgICJ0eXBlIjogImNvbW1hbmQiCiAgICAgICAgICB9CiAgICAgICAgXQogICAgICB9CiAgICBdLAogICAgIlN1YmFnZW50U3RhcnQiOiBbCiAgICAgIHsKICAgICAgICAiaG9va3MiOiBbCiAgICAgICAgICB7CiAgICAgICAgICAgICJjb21tYW5kIjogIi91c3IvbG9jYWwvYmluL3N0cmF6YSBob29rIC0taGFybmVzcyBjbGF1ZGUtY29kZSIsCiAgICAgICAgICAgICJ0eXBlIjogImNvbW1hbmQiCiAgICAgICAgICB9CiAgICAgICAgXQogICAgICB9CiAgICBdLAogICAgIlN1YmFnZW50U3RvcCI6IFsKICAgICAgewogICAgICAgICJob29rcyI6IFsKICAgICAgICAgIHsKICAgICAgICAgICAgImNvbW1hbmQiOiAiL3Vzci9sb2NhbC9iaW4vc3RyYXphIGhvb2sgLS1oYXJuZXNzIGNsYXVkZS1jb2RlIiwKICAgICAgICAgICAgInR5cGUiOiAiY29tbWFuZCIKICAgICAgICAgIH0KICAgICAgICBdCiAgICAgIH0KICAgIF0sCiAgICAiVXNlclByb21wdFN1Ym1pdCI6IFsKICAgICAgewogICAgICAgICJob29rcyI6IFsKICAgICAgICAgIHsKICAgICAgICAgICAgImNvbW1hbmQiOiAiL3Vzci9sb2NhbC9iaW4vc3RyYXphIGhvb2sgLS1oYXJuZXNzIGNsYXVkZS1jb2RlIiwKICAgICAgICAgICAgInR5cGUiOiAiY29tbWFuZCIKICAgICAgICAgIH0KICAgICAgICBdCiAgICAgIH0KICAgIF0KICB9Cn0=",
      "content_hash": "sha256:c9ee42bfb613e2e9165bad88ee8d77e889ddb02aa4effe7aa9f664d51b928ab8",
      "key_id": "spec-example-key",
      "sig": "8wgakGKCTDr9IHnTOYpMCehAFLC9547JAhpDZ2hLJpaC8YpFsW0NYlScxlfmP11JT/TgGSW8nUbQP4uKg5a6Cw=="
    },
    {
      "artifact": "mcp.claude-code",
      "content": "ewogICJtY3BTZXJ2ZXJzIjogewogICAgInN0cmF6YSI6IHsKICAgICAgImFyZ3MiOiBbCiAgICAgICAgIm1jcCIsCiAgICAgICAgIi0taGFybmVzcyIsCiAgICAgICAgImNsYXVkZS1jb2RlIgogICAgICBdLAogICAgICAiY29tbWFuZCI6ICIvdXNyL2xvY2FsL2Jpbi9zdHJhemEiLAogICAgICAidHlwZSI6ICJzdGRpbyIKICAgIH0KICB9Cn0=",
      "content_hash": "sha256:8f48244317c3c5dd328a96687b2a8e8bb8046b436057f9d7e33277385b9f5e66",
      "key_id": "spec-example-key",
      "sig": "umcNiIsXmFtRSZjgXv85rlX3nRI6vv0t8teOeSZ3Y3fMp0UdU0Fnmy3Zg2KI6D4Ku7pHdmd/agasX+82tY6ZAw=="
    }
  ]
}
