{
  "format": 1,
  "kind": "harness-config",
  "harness": "codex",
  "platform": "windows",
  "artifacts": [
    {
      "artifact": "hooks.codex",
      "content": "IyBCRUdJTiBzdHJhemEtbWFuYWdlZCAoc3RyYXphIGluc3RhbGwgLS1tYW5hZ2VkIHdyaXRlcyB0aGlzIGJsb2NrOyBkbyBub3QgZWRpdCBpbnNpZGUpCltmZWF0dXJlc10KaG9va3MgPSB0cnVlCgpbaG9va3NdCm1hbmFnZWRfZGlyID0gJ0M6XFByb2dyYW1EYXRhXHN0cmF6YVxiaW4nCndpbmRvd3NfbWFuYWdlZF9kaXIgPSAnQzpcUHJvZ3JhbURhdGFcc3RyYXphXGJpbicKCltbaG9va3MuU2Vzc2lvblN0YXJ0XV0KbWF0Y2hlciA9ICIqIgpbW2hvb2tzLlNlc3Npb25TdGFydC5ob29rc11dCnR5cGUgPSAiY29tbWFuZCIKY29tbWFuZCA9ICdDOlxQcm9ncmFtRGF0YVxzdHJhemFcYmluXHN0cmF6YS1ob29rLWNvZGV4LmNtZCcKCltbaG9va3MuUHJlVG9vbFVzZV1dCm1hdGNoZXIgPSAiKiIKW1tob29rcy5QcmVUb29sVXNlLmhvb2tzXV0KdHlwZSA9ICJjb21tYW5kIgpjb21tYW5kID0gJ0M6XFByb2dyYW1EYXRhXHN0cmF6YVxiaW5cc3RyYXphLWhvb2stY29kZXguY21kJwoKW1tob29rcy5Vc2VyUHJvbXB0U3VibWl0XV0KbWF0Y2hlciA9ICIqIgpbW2hvb2tzLlVzZXJQcm9tcHRTdWJtaXQuaG9va3NdXQp0eXBlID0gImNvbW1hbmQiCmNvbW1hbmQgPSAnQzpcUHJvZ3JhbURhdGFcc3RyYXphXGJpblxzdHJhemEtaG9vay1jb2RleC5jbWQnCgpbW2hvb2tzLlN0b3BdXQptYXRjaGVyID0gIioiCltbaG9va3MuU3RvcC5ob29rc11dCnR5cGUgPSAiY29tbWFuZCIKY29tbWFuZCA9ICdDOlxQcm9ncmFtRGF0YVxzdHJhemFcYmluXHN0cmF6YS1ob29rLWNvZGV4LmNtZCcKCltbaG9va3MuU2Vzc2lvbkVuZF1dCm1hdGNoZXIgPSAiKiIKW1tob29rcy5TZXNzaW9uRW5kLmhvb2tzXV0KdHlwZSA9ICJjb21tYW5kIgpjb21tYW5kID0gJ0M6XFByb2dyYW1EYXRhXHN0cmF6YVxiaW5cc3RyYXphLWhvb2stY29kZXguY21kJwp0aW1lb3V0ID0gMwoKW1tob29rcy5TdWJhZ2VudFN0YXJ0XV0KbWF0Y2hlciA9ICIqIgpbW2hvb2tzLlN1YmFnZW50U3RhcnQuaG9va3NdXQp0eXBlID0gImNvbW1hbmQiCmNvbW1hbmQgPSAnQzpcUHJvZ3JhbURhdGFcc3RyYXphXGJpblxzdHJhemEtaG9vay1jb2RleC5jbWQnCgpbW2hvb2tzLlN1YmFnZW50U3RvcF1dCm1hdGNoZXIgPSAiKiIKW1tob29rcy5TdWJhZ2VudFN0b3AuaG9va3NdXQp0eXBlID0gImNvbW1hbmQiCmNvbW1hbmQgPSAnQzpcUHJvZ3JhbURhdGFcc3RyYXphXGJpblxzdHJhemEtaG9vay1jb2RleC5jbWQnCiMgRU5EIHN0cmF6YS1tYW5hZ2VkCg==",
      "content_hash": "sha256:77c8655eeb6fb020f835e61f1d1d1456dbcc352af946f2f20232d0533ebf3db2",
      "key_id": "spec-example-key",
      "sig": "XwuYDUohZf6Bc+COGEEdikrvhZUm/AvD+sxumWBUEvmwCVL77Y3Jol7SG/GQouJPyB3WnJT2mOUGmDMghJnUCw=="
    }
  ]
}
